The Economics Classroom,2,The Building Blocks of Macroeconomics,3535,Learning Earning and Saving,3535,Trading Globally,3535,Why Markets Work,3535,Monetary and Fiscal Policy,3535,Growth and Entrepreneurship,3535,How Economists Think,3532
Physics in the 21st Century,1,The Fundamental Interactions,1697,The Quantum World,1704,String Theory and Extra Dimensions,1705,The Basic Building Blocks of Matter,1707,Manipulating Light,1707,Macroscopic Quantum Mechanics,1705,Emergent Behavior in Quantum Matter,1706,Gravity,1695,Dark Energy,1705,Dark Matter,1706,Biophysics,1705
Seasons of Life,2,Infancy and Early Childhood,3518,Childhood and Adolescence,3457,Early Adulthood,3463,Middle Adulthood,3444,Late Adulthood,3437
Voices and Visions,2,William Carlos Williams,3435,Walt Whitman,3392,Wallace Stevens,3475,T.S. Eliot,3455,Sylvia Path,3418,Robert Frost,3437,Marianne Moore,3464,Langston Hughes,3424,Hart Crane,3473,Emily Dickinson,3429,Elizabeth Biship,3568
The Kalb Report,2,Remembering President John F Kennedy,3408,Why Murrow Matters in the Digital Age,3479,A Conversation With Thomas Friedman,3406,A Conversation With Supreme Court Justices,3414,A Conversation With Ted Koppel,3406
The Habitable Planet,1,Risk Exposure and Health,1708,Many Planets One Earth,1693,Earths Changing Climate,1708,Water Resources,1706,Oceans,1756,Human Population Dynamics,1706,Looking Forward - Our Global Experiment,1708,Ecosystems,1707,Energy Challenges,1706,Biodiversity Decline,1706,Agriculture,1705,Atmospheric Pollution,1706
Rediscovering Biology,1,Proteins and Proteomics,1703,Neurobiology,1703,Genomics,1703,Human Evolution,1704,Genetics of Development,1733,Genetically Modified Organisms,1703,Cell Biology and Cancer,1793,Biology of Sex and Gender,1734,Biodiversity,1703
Growing Old in a New Age,2,Work Retirement and Economic Status,3466,Love Intimacy and Sexuality,3408,Learning Memory and Speed of Behavior,3467,Intellect Personality and Mental Health,3465,Dying Death and Bereavement,3467,Societal and Political Aspects of Aging,3461,Social Roles and Relationships in Old Age,3407,Maximizing Physical Potential in Older Adults,3479,Illness and Disability,3467,Future of Aging,3467,Family and Intergenerational Relationships,3469
The Whole Child,1,Too Babies and Children,1620,Everybodys Special,1619,Listening to Families,1620,Respecting Diversity,1620,Growing Minds,1619,Getting Along Together,1618,Creativity and Play,1620,Dealing With Feelings,1619,By Leaps and Bounds,1619,Building Inner Controls,1621
In Search of the Novel,2,Whats the Story,3534,Whats in it for Me,3535,Why do I Have to Read This Book,3534,Who Owns the Novel,3512,Who Am I in This Story,3534,Where do Novels Come From,3533,Are Novels Real,3534,Am I Getting Through,3535
Art of the Western World,2,The Early Renaissance,3438,The Classical Ideal,3437,A White Garment of Churches Romanesque and Gothic,3482,Realms of Light - Baroque,3463,The High Renaissance,3478,Into the 20th Century,3471,In Our Own Time,3445,Age of Reason Age of Passion,3478
Colour in Your Life,1,Sequence 00,1440,Sequence 02,1440,Sequence 03,1440,Sequence 04,1440,Sequence 05,1440,Sequence 06,1440,Sequence 07,1440,Sequence 08,1440,Sequence 09,1440,Sequence 10,1440,Sequence 11,1440,Sequence 12,1440,Sequence 13,1440,Sequence 14,1440,Sequence 15,1440,Sequence 16,1440,Sequence 17,1440,Sequence 18,1440,Sequence 19,1440,Sequence 20,1440,Sequence 21,1440,Sequence 22,1440,Sequence 23,1440,Sequence 24,1440,Sequence 25,1440,Sequence 26,1440
Works in Progress,1,Mierle Ulseles,1564,June Wayne,1534,Lorna Simpson,1562,Hung Liu,1564,Judy Baca,1549,Goat Island,1564,Guillermo Gomez-Pena,1562,Bill Viola,1564,Beverly Buchanan,1563
Out of the Past,2,The Spirit World,3479,The Hearth,3451,Power Prestige and Wealth,3498,Signs and Symbols,3473,Realms,3497,New Worlds,3499,Collapse,3502,Artisans and Traders,3487
Primary Sources,2,The Census,3504,Cans Coal and Corporations,3453,The Virginia Company,3437,The Lowell System,3473,Korea and the Cold War,3533,Disease and History,3484,Concerning Emancipation,3494,Common Sense,3539
The Learning Classroom,1,Thinking About Thinking Metacognition,1735,Multiple Intelligences,1735,Lessons for Life Learning and Transfer,1735,Learning From Others,1735,Expectations for Success Motivation and Learning,1735,Culture and Learning,1735,Cognittive Processing,1735,Cognitive Apprenticeship,1735
The Constitution,2,School Prayer Gun Control and the Right to Assemble,3419,Right to Live Right to Die,3471,Nomination Election and Succession of the President,3497,Criminal Justice and a Defendants Right to a Fair Trial,3515,National Security and Freedom of the Press,3494,Immigration Reform,3495,Executive Privilige and Delegation of Powers,3537,Crime and Punishments,3459,Crime and Insanity,3505,Affirmative Action Versus Reverse Discrimination,3535,Campaign Spending,3431
Unseen Life on Earth,1,Unity of Living Systems,1622,Microbial Universe,1578,Reading the Code of Life,1574,Microbial Interactions,1634,Microbial Diversity,1633,Microbial Control,1623,Microbes and Human Disease,1609,Metabolism,1625,Human Defenses,1594
Exploring the World of Music,1,Transmission Learning Music,1619,Texture,1619,Rhythm,1619,Music and Technology,1619,Melody,1619,Harmony,1619,Composers and Improvisers,1619,Form The Shape of Music,1619
Art Through Time,1,The Urban Experience,1605,Writing,1606,The Natural World,1606,Portraits,1602,Dreams and Visions,1605,Domestic Life,1604,Death,1606,Cosmology and Belief,1605,Ceremony and Society,1606
